<?xml version="1.0" encoding="UTF-8"?>

<root xmlns:xsi='http://www.w3.org/2001/XMLSchema-instance'
    xmlns='http://luoying.huliqing.name'
    xsi:schemaLocation='http://luoying.huliqing.name meta/position.xsd'>

    <!--=====================================================================-->
    <!--通用配置-->
    <!--=====================================================================-->

    <positionFixedPoint id="positionOrigin" point="0, 0, 0" />
    
    <positionRandomSphere id="positionCommonSp0_5" center="0,0,0" radius="0.5" />
    <positionRandomSphere id="positionCommonSp0_7" center="0,0,0" radius="0.7" />
    <positionRandomSphere id="positionCommonSp1_0" center="0,0,0" radius="1" />

    <!--默认的射击点-->
    <positionFixedPoint id="positionDefShotUp" point="0,2,7" />
    <positionFixedPoint id="positionDefShotLeft" point="2,1,7" />
    <positionFixedPoint id="positionDefShotRight" point="-2,1,7" />
    
    <!--=====================================================================-->
    <!--特定配置-->
    <!--=====================================================================-->

    <positionRandomSphere id="positionFlameShape" center="0, 0, 0" radius="1" />
    
    <positionRandomSphere id="positionFlashShape" center="0, 0, 0" radius="0.05" />
    
</root>



